{
  "schemaVersion": 1,
  "gameId": "22222222-2222-4222-8222-222222222222",
  "version": "1.0.0-beta.1",
  "integrationVersion": 1,
  "capabilities": { "local": { "players": { "min": 1, "max": 1 } } },
  "client": { "entrypoints": { "local": "play/start.html" }, "requirements": { "crossOriginIsolation": false } }
}
