{
  "schemaVersion": 1,
  "gameId": "11111111-1111-4111-8111-111111111111",
  "version": "0.1.0",
  "integrationVersion": 1,
  "capabilities": {
    "online": { "access": ["public", "private"], "players": { "min": 2, "max": 2 } },
    "local": { "players": { "min": 2, "max": 2 } }
  },
  "client": { "entrypoints": { "online": "index.html", "local": "index.html" } }
}
